{"candidate_id":"WEXP-CORE-01-VECTORS-002","classification":"supplied-fatal-rejection","derivation":"Section 6.2: if the structurally usable input has a non-empty valid fatal_conditions set, Core returns that complete set through the fixed rejection projection; this check precedes the inadmissible-claim check. E_UNKNOWN_CRITICAL_SEMANTIC is one of the Core-defined supplied fatal members and is registered by the applied profile. Section 8.4 gives the projection, whose input-derived components carry unavailable, represented as JSON null per R-001. Distinguishes ingress check 5 from check 6, which published fixture C09 covers. Never derived from an engine.","expected":{"asserted_claim":null,"asserted_claim_supported":false,"boundary_ceiling":null,"boundary_grounding":null,"counter_evidence":null,"evaluation_context":null,"evaluation_gap_entries":[],"evaluation_gaps":[],"evaluation_scope":null,"fatal_reasons":["E_UNKNOWN_CRITICAL_SEMANTIC"],"inherited_limitations":null,"maximal_supported_claims":[],"recorder_relations":null,"semantics_version":"wexp-core-1","substantive_reasons":[],"support_entries":[],"support_relations":[],"supported_claims":[],"target":null,"verdict":"reject"},"expected_code":"E_UNKNOWN_CRITICAL_SEMANTIC","harness_representation":"WEXP Core-01 vector harness 002","input":{"asserted_claim":{"base":"invocation","qualifiers":[]},"base_findings":[{"base":"invocation","basis_refs":["invocation"],"evaluation_context_ref":"C","limitations":[],"reasons":[],"semantic_validation":"supported","target":"T","target_binding":"supported"}],"boundary_finding":{"basis_refs":["bd"],"ceiling_base":"invocation","evaluation_context_ref":"C","grounding":"attributed","limitations":[],"reasons":[],"status":"supported","target":"T","target_binding":"supported"},"counter_evidence":[{"affected_claims":[],"basis_refs":[],"limitations":[],"reasons":[],"status":"not-supplied"}],"evaluation_context":{"id":"C"},"evaluation_scope":{"authenticity":"evaluated","boundary-grounding":"evaluated","carrier-mapping":"evaluated","composition":"evaluated","counter-evidence":"evaluated","execution-support":"evaluated","independent-verification":"evaluated","intent-support":"evaluated","invocation-support":"evaluated","observation-support":"evaluated","provenance-support":"evaluated","target-binding":"evaluated"},"fatal_conditions":["E_UNKNOWN_CRITICAL_SEMANTIC"],"inherited_limitations":[],"profile_evaluation_gaps":[],"qualifier_findings":[],"recorder_relations":[],"representation":"core-01-qualification-001-harness","semantics_version":"wexp-core-1","target":"T"},"purpose":"A structurally usable input carries a valid supplied fatal condition, so Core returns that complete set through the fixed rejection projection without appraising the otherwise-supported claim.","requirement_ids":["WEXP-CORE-01-V002-REQ-F2006"],"snapshot":{"id":"draft-sergeev-wexp-core-01","xml_sha256":"84c0a16467585c29925339a10dd287c2e67bfe21ed592826254bf424dc24f56d"},"source_fixture":"F2006","vector_id":"WEXP-CORE-01-V002-TV-2006"}
