{
  "candidate_id": "WEXP-CORE-01-VECTORS-001",
  "classification": "claim-domain-fatal",
  "derivation": "Expected appraisal transcribed from draft-sergeev-wexp-core-01 (XML sha256 84c0a16467585c29925339a10dd287c2e67bfe21ed592826254bf424dc24f56d), section 'Normative Semantic Test Vectors', fixture C09; never from engine output.",
  "expected": {
    "asserted_claim": null,
    "asserted_claim_supported": false,
    "boundary_ceiling": null,
    "boundary_grounding": null,
    "counter_evidence": null,
    "evaluation_context": null,
    "evaluation_gap_entries": [],
    "evaluation_gaps": [],
    "evaluation_scope": null,
    "fatal_reasons": [
      "E_CLAIM_OUT_OF_DOMAIN"
    ],
    "inherited_limitations": null,
    "maximal_supported_claims": [],
    "recorder_relations": null,
    "semantics_version": "wexp-core-1",
    "substantive_reasons": [],
    "support_entries": [],
    "support_relations": [],
    "supported_claims": [],
    "target": null,
    "verdict": "reject"
  },
  "expected_code": null,
  "harness_representation": "WEXP Core-01 vector harness 001",
  "input": {
    "asserted_claim": {
      "base": "intent",
      "qualifiers": [
        "PROV"
      ]
    },
    "base_findings": [],
    "boundary_finding": {
      "basis_refs": [
        "bd"
      ],
      "ceiling_base": "execution",
      "evaluation_context_ref": "C",
      "grounding": "attributed",
      "limitations": [],
      "reasons": [],
      "status": "supported",
      "target": "T",
      "target_binding": "supported"
    },
    "counter_evidence": [
      {
        "affected_claims": [],
        "basis_refs": [],
        "limitations": [],
        "reasons": [],
        "status": "not-supplied"
      }
    ],
    "evaluation_context": {
      "id": "C"
    },
    "evaluation_scope": {
      "authenticity": "evaluated",
      "boundary-grounding": "evaluated",
      "carrier-mapping": "evaluated",
      "composition": "evaluated",
      "counter-evidence": "evaluated",
      "execution-support": "evaluated",
      "independent-verification": "evaluated",
      "intent-support": "evaluated",
      "invocation-support": "evaluated",
      "observation-support": "evaluated",
      "provenance-support": "evaluated",
      "target-binding": "evaluated"
    },
    "fatal_conditions": [],
    "inherited_limitations": [],
    "profile_evaluation_gaps": [],
    "qualifier_findings": [],
    "recorder_relations": [],
    "representation": "core-01-qualification-001-harness",
    "semantics_version": "wexp-core-1",
    "target": "T"
  },
  "purpose": "An inadmissible intent+PROV claim is rejected via the fixed projection with E_CLAIM_OUT_OF_DOMAIN.",
  "requirement_ids": [
    "WEXP-CORE-01-Q001-REQ-0009"
  ],
  "snapshot": {
    "id": "draft-sergeev-wexp-core-01",
    "xml_sha256": "84c0a16467585c29925339a10dd287c2e67bfe21ed592826254bf424dc24f56d"
  },
  "source_fixture": "C09",
  "vector_id": "WEXP-CORE-01-Q001-TV-0009"
}
