{"candidate_id":"WEXP-CORE-01-VECTORS-002","classification":"asserted-base-over-ceiling-negative","derivation":"Section 8.6: a present asserted-base aggregate whose base is deeper than the ceiling produces E_BASE_EXCEEDS_BOUNDARY, and consequently not E_MISSING_REQUIRED_EVIDENCE. Section 8.2: the asserted claim is admissible but not exactly supported, so the verdict is downgrade. Control for TV-2002: proves the row was narrowed, not disabled. Never derived from an engine.","expected":{"asserted_claim":{"base":"execution","qualifiers":[]},"asserted_claim_supported":false,"boundary_ceiling":"intent","boundary_grounding":"attributed","counter_evidence":[{"affected_claims":[],"basis_refs":[],"limitations":[],"reasons":[],"status":"not-supplied"}],"evaluation_context":{"id":"C"},"evaluation_gap_entries":[],"evaluation_gaps":[],"evaluation_scope":{"authenticity":"evaluated","boundary-grounding":"evaluated","carrier-mapping":"evaluated","composition":"evaluated","counter-evidence":"evaluated","execution-support":"evaluated","independent-verification":"evaluated","intent-support":"evaluated","invocation-support":"evaluated","observation-support":"evaluated","provenance-support":"evaluated","target-binding":"evaluated"},"fatal_reasons":[],"inherited_limitations":[],"maximal_supported_claims":[{"base":"intent","qualifiers":[]}],"recorder_relations":[],"semantics_version":"wexp-core-1","substantive_reasons":["E_BASE_EXCEEDS_BOUNDARY"],"support_entries":[{"basis_refs":["bd","intent"],"claim":{"base":"intent","qualifiers":[]},"limitations":[]}],"support_relations":[{"relation":"support-below-claim","supported_claim":{"base":"intent","qualifiers":[]}}],"supported_claims":[{"base":"intent","qualifiers":[]}],"target":"T","verdict":"downgrade"},"expected_code":"E_BASE_EXCEEDS_BOUNDARY","harness_representation":"WEXP Core-01 vector harness 002","input":{"asserted_claim":{"base":"execution","qualifiers":[]},"base_findings":[{"base":"intent","basis_refs":["intent"],"evaluation_context_ref":"C","limitations":[],"reasons":[],"semantic_validation":"supported","target":"T","target_binding":"supported"},{"base":"execution","basis_refs":["execution"],"evaluation_context_ref":"C","limitations":[],"reasons":[],"semantic_validation":"supported","target":"T","target_binding":"supported"}],"boundary_finding":{"basis_refs":["bd"],"ceiling_base":"intent","evaluation_context_ref":"C","grounding":"attributed","limitations":[],"reasons":[],"status":"supported","target":"T","target_binding":"supported"},"counter_evidence":[{"affected_claims":[],"basis_refs":[],"limitations":[],"reasons":[],"status":"not-supplied"}],"evaluation_context":{"id":"C"},"evaluation_scope":{"authenticity":"evaluated","boundary-grounding":"evaluated","carrier-mapping":"evaluated","composition":"evaluated","counter-evidence":"evaluated","execution-support":"evaluated","independent-verification":"evaluated","intent-support":"evaluated","invocation-support":"evaluated","observation-support":"evaluated","provenance-support":"evaluated","target-binding":"evaluated"},"fatal_conditions":[],"inherited_limitations":[],"profile_evaluation_gaps":[],"qualifier_findings":[],"recorder_relations":[],"representation":"core-01-qualification-001-harness","semantics_version":"wexp-core-1","target":"T"},"purpose":"The asserted execution claim is itself deeper than the intent ceiling, so the boundary-exceeded row applies and the claim is not supported.","requirement_ids":["WEXP-CORE-01-V002-REQ-C2003"],"snapshot":{"id":"draft-sergeev-wexp-core-01","xml_sha256":"84c0a16467585c29925339a10dd287c2e67bfe21ed592826254bf424dc24f56d"},"source_fixture":"C2003","vector_id":"WEXP-CORE-01-V002-TV-2003"}
