{"candidate_id":"WEXP-CORE-01-VECTORS-002","classification":"qualifier-domain-fatal","derivation":"Section 4.4: a claim is admissible only if PROV is absent or the base is execution; an asserted claim outside this domain is rejected with E_CLAIM_OUT_OF_DOMAIN, and an appraiser must not silently delete the invalid qualifier and reinterpret the assertion. Section 6.2 check 6 places this after the supplied-fatal check. Section 8.4 gives the fixed rejection projection, whose input-derived components carry the logical value unavailable, represented per R-001 as JSON null. Never derived from an engine.","expected":{"asserted_claim":null,"asserted_claim_supported":false,"boundary_ceiling":null,"boundary_grounding":null,"counter_evidence":null,"evaluation_context":null,"evaluation_gap_entries":[],"evaluation_gaps":[],"evaluation_scope":null,"fatal_reasons":["E_CLAIM_OUT_OF_DOMAIN"],"inherited_limitations":null,"maximal_supported_claims":[],"recorder_relations":null,"semantics_version":"wexp-core-1","substantive_reasons":[],"support_entries":[],"support_relations":[],"supported_claims":[],"target":null,"verdict":"reject"},"expected_code":"E_CLAIM_OUT_OF_DOMAIN","harness_representation":"WEXP Core-01 vector harness 002","input":{"asserted_claim":{"base":"invocation","qualifiers":["PROV"]},"base_findings":[{"base":"invocation","basis_refs":["invocation"],"evaluation_context_ref":"C","limitations":[],"reasons":[],"semantic_validation":"supported","target":"T","target_binding":"supported"}],"boundary_finding":{"basis_refs":["bd"],"ceiling_base":"invocation","evaluation_context_ref":"C","grounding":"attributed","limitations":[],"reasons":[],"status":"supported","target":"T","target_binding":"supported"},"counter_evidence":[{"affected_claims":[],"basis_refs":[],"limitations":[],"reasons":[],"status":"not-supplied"}],"evaluation_context":{"id":"C"},"evaluation_scope":{"authenticity":"evaluated","boundary-grounding":"evaluated","carrier-mapping":"evaluated","composition":"evaluated","counter-evidence":"evaluated","execution-support":"evaluated","independent-verification":"evaluated","intent-support":"evaluated","invocation-support":"evaluated","observation-support":"evaluated","provenance-support":"evaluated","target-binding":"evaluated"},"fatal_conditions":[],"inherited_limitations":[],"profile_evaluation_gaps":[],"qualifier_findings":[],"recorder_relations":[],"representation":"core-01-qualification-001-harness","semantics_version":"wexp-core-1","target":"T"},"purpose":"PROV is admissible only on execution, so an asserted (invocation,{PROV}) claim is outside the admissible domain.","requirement_ids":["WEXP-CORE-01-V002-REQ-G2007"],"snapshot":{"id":"draft-sergeev-wexp-core-01","xml_sha256":"84c0a16467585c29925339a10dd287c2e67bfe21ed592826254bf424dc24f56d"},"source_fixture":"G2007","vector_id":"WEXP-CORE-01-V002-TV-2007"}
