{"candidate_id":"WEXP-CORE-01-VECTORS-003","classification":"foreign-scope-strong-qualifier-negative","derivation":"Section 8.1: a base is in B only if, among the other conditions, \"the finding names the same target and evaluation context as the appraisal input\". Section 8.4 states the same requirement inside the admission predicate itself: f.target == input.target and f.evaluation_context_ref == input.evaluation_context.id. Section 6 adds that \"a foreign-scoped aggregate is not negative evidence for this appraisal\" -- it is not evidence here at all, so it neither supports a claim nor stands in for an aggregate that is genuinely absent. Section 8.6 then reports the asserted aggregate as absent, and Section 8.2 gives downgrade because the asserted claim is not an exact member of SupportedClaims. Section 8.1 admits IV into Q(b) only when the IV finding passes its assessments \"for the exact target and evaluation context\", so a qualifier cannot rescue a base that was never admitted, and cannot be admitted itself on a foreign scope.","expected":{"asserted_claim":{"base":"execution","qualifiers":["IV"]},"asserted_claim_supported":false,"boundary_ceiling":"execution","boundary_grounding":"attributed","counter_evidence":[{"affected_claims":[],"basis_refs":[],"limitations":[],"reasons":[],"status":"not-supplied"}],"evaluation_context":{"id":"C"},"evaluation_gap_entries":[],"evaluation_gaps":[],"evaluation_scope":{"authenticity":"evaluated","boundary-grounding":"evaluated","carrier-mapping":"evaluated","composition":"evaluated","counter-evidence":"evaluated","execution-support":"evaluated","independent-verification":"evaluated","intent-support":"evaluated","invocation-support":"evaluated","observation-support":"evaluated","provenance-support":"evaluated","target-binding":"evaluated"},"fatal_reasons":[],"inherited_limitations":[],"maximal_supported_claims":[],"recorder_relations":[],"semantics_version":"wexp-core-1","substantive_reasons":["E_MISSING_REQUIRED_EVIDENCE"],"support_entries":[],"support_relations":[],"supported_claims":[],"target":"T","verdict":"downgrade"},"expected_code":"E_MISSING_REQUIRED_EVIDENCE","harness_representation":"WEXP Core-01 vector harness 003","input":{"asserted_claim":{"base":"execution","qualifiers":["IV"]},"base_findings":[{"base":"execution","basis_refs":["execution-T-other"],"evaluation_context_ref":"C-other","limitations":[],"reasons":[],"semantic_validation":"supported","target":"T-other","target_binding":"supported"}],"boundary_finding":{"basis_refs":["bd"],"ceiling_base":"execution","evaluation_context_ref":"C","grounding":"attributed","limitations":[],"reasons":[],"status":"supported","target":"T","target_binding":"supported"},"counter_evidence":[{"affected_claims":[],"basis_refs":[],"limitations":[],"reasons":[],"status":"not-supplied"}],"evaluation_context":{"id":"C"},"evaluation_scope":{"authenticity":"evaluated","boundary-grounding":"evaluated","carrier-mapping":"evaluated","composition":"evaluated","counter-evidence":"evaluated","execution-support":"evaluated","independent-verification":"evaluated","intent-support":"evaluated","invocation-support":"evaluated","observation-support":"evaluated","provenance-support":"evaluated","target-binding":"evaluated"},"fatal_conditions":[],"inherited_limitations":[],"profile_evaluation_gaps":[],"qualifier_findings":[{"basis_refs":["iv-T-other"],"evaluation_context_ref":"C-other","independence_validation":"supported","limitations":[],"qualified_base":"execution","qualifier":"IV","reasons":[],"semantic_validation":"supported","target":"T-other","target_binding":"supported"}],"recorder_relations":[],"representation":"core-01-qualification-001-harness","semantics_version":"wexp-core-1","target":"T"},"purpose":"Favourable target binding, semantic validation and independence on a foreign-scoped pair. Evidence quality is not a substitute for evidence identity.","requirement_ids":["WEXP-CORE-01-V003-REQ-S3005"],"snapshot":{"id":"draft-sergeev-wexp-core-01","xml_sha256":"84c0a16467585c29925339a10dd287c2e67bfe21ed592826254bf424dc24f56d"},"source_fixture":"S3005","vector_id":"WEXP-CORE-01-V003-TV-3005"}
