{"candidate_id":"WEXP-CORE-01-VECTORS-003","classification":"mixed-scope-fatal","derivation":"Section 6.2 states the Core rejection checks as an ordered sequence, and exact target and context scope is one of the cross-field invariants at position 4: \"A well-typed wexp-core-1 input that violates a cross-field invariant returns E_PROFILE_MAPPING_INVALID. Cross-field invariants include aggregate cardinality and keys, exact target and context scope, ...\" Section 6 says why: \"The boundary finding, every base and qualifier aggregate, and every profile-gap entry have a target equal to the top-level target and an evaluation_context_ref equal to the top-level evaluation-context identifier. A foreign-scoped aggregate is not negative evidence for this appraisal; it violates the normalized-input cross-field contract and produces E_PROFILE_MAPPING_INVALID.\" The check terminates the appraisal, so Section 8 support construction never runs and no substantive reason or evaluation gap is produced. Section 8.4 gives the fixed rejection projection: every input-derived component is unavailable and every derived set is empty. E_PROFILE_MAPPING_INVALID is derived only by the ordered Core checks and is invalid as a supplied member of fatal_conditions, so the profile names it rather than permitting it. The invocation aggregate satisfies every condition and would enter B on its own. It does not matter: the cross-field invariant is evaluated over the whole input at position 4, so the appraisal is rejected before B is constructed. An implementation that answered accept with the invocation claim here would be applying Section 8 to an input Section 6.2 had already refused.","expected":{"asserted_claim":null,"asserted_claim_supported":false,"boundary_ceiling":null,"boundary_grounding":null,"counter_evidence":null,"evaluation_context":null,"evaluation_gap_entries":[],"evaluation_gaps":[],"evaluation_scope":null,"fatal_reasons":["E_PROFILE_MAPPING_INVALID"],"inherited_limitations":null,"maximal_supported_claims":[],"recorder_relations":null,"semantics_version":"wexp-core-1","substantive_reasons":[],"support_entries":[],"support_relations":[],"supported_claims":[],"target":null,"verdict":"reject"},"expected_code":"E_PROFILE_MAPPING_INVALID","harness_representation":"WEXP Core-01 vector harness 003","input":{"asserted_claim":{"base":"invocation","qualifiers":[]},"base_findings":[{"base":"invocation","basis_refs":["invocation-T"],"evaluation_context_ref":"C","limitations":[],"reasons":[],"semantic_validation":"supported","target":"T","target_binding":"supported"},{"base":"execution","basis_refs":["execution-T-other"],"evaluation_context_ref":"C","limitations":[],"reasons":[],"semantic_validation":"supported","target":"T-other","target_binding":"supported"}],"boundary_finding":{"basis_refs":["bd"],"ceiling_base":"execution","evaluation_context_ref":"C","grounding":"attributed","limitations":[],"reasons":[],"status":"supported","target":"T","target_binding":"supported"},"counter_evidence":[{"affected_claims":[],"basis_refs":[],"limitations":[],"reasons":[],"status":"not-supplied"}],"evaluation_context":{"id":"C"},"evaluation_scope":{"authenticity":"evaluated","boundary-grounding":"evaluated","carrier-mapping":"evaluated","composition":"evaluated","counter-evidence":"evaluated","execution-support":"evaluated","independent-verification":"evaluated","intent-support":"evaluated","invocation-support":"evaluated","observation-support":"evaluated","provenance-support":"evaluated","target-binding":"evaluated"},"fatal_conditions":[],"inherited_limitations":[],"profile_evaluation_gaps":[],"qualifier_findings":[],"recorder_relations":[],"representation":"core-01-qualification-001-harness","semantics_version":"wexp-core-1","target":"T"},"purpose":"A fully valid in-scope invocation finding sits beside a foreign-scoped execution finding. One valid finding does not legalise an input that carries a foreign-scoped aggregate: the contract is a property of the input, not of the best aggregate in it.","requirement_ids":["WEXP-CORE-01-V003-REQ-S3007"],"snapshot":{"id":"draft-sergeev-wexp-core-01","xml_sha256":"84c0a16467585c29925339a10dd287c2e67bfe21ed592826254bf424dc24f56d"},"source_fixture":"S3007","vector_id":"WEXP-CORE-01-V003-TV-3007"}
